{
  "schema_version": "1.0",
  "record_id": "z-image-turbo",
  "name": "Z-Image-Turbo",
  "upstream_url": "https://huggingface.co/Tongyi-MAI/Z-Image-Turbo",
  "code_license_status": "verified",
  "weights_license_status": "conditional",
  "commercial_use": "allowed_with_conditions",
  "redistribution": "allowed_with_conditions",
  "attribution_requirements": [],
  "source_provenance": ["Hugging Face model card identifies the Turbo checkpoint as Apache 2.0"],
  "review_status": "human_review_required",
  "verified_at": "2026-10-23",
  "notes": "Verify fine-tunes, derivative checkpoints and other Z-Image family variants separately. 12 GB operation is not guaranteed by the official docs."
}
